{
  "id": "factory-1234567890",
  "spec": "skills/factory/fixtures/sample-spec/README.md",
  "status": "approved",
  "branch": "factory/factory-1234567890",
  "attempts": [
    {
      "attempt": 1,
      "build": {
        "files_changed": ["greet.sh"],
        "tests": "pass",
        "commit": "abc1234"
      },
      "inspect": {
        "verdict": "approve",
        "summary": "All good"
      }
    }
  ],
  "metrics": {
    "cycle_time_seconds": 120,
    "total_attempts": 1,
    "first_pass_yield": true
  }
}
